pmid,title,abstract
41607364,"Overnight Dynamics of Ventricular Cerebrospinal Fluid Amyloid-Beta, Lactate and Hypocretin in Patients With Hydrocephalus: A Pilot Study.","This pilot observational study evaluated whether frequent overnight sampling of ventricular cerebrospinal fluid could clarify how sleep, hypocretin and lactate relate to amyloid-β42 dynamics in adults with hydrocephalus. Seven participants underwent hourly ventricular cerebrospinal fluid sampling from early evening to late morning during inpatient monitoring, combined with full polysomnography. Concentrations of amyloid-β42, hypocretin, lactate, melatonin and electrolytes were measured and normalised to each individual's mean. Relationships with sleep stage and circadian patterns were examined using correlation analysis and cosinor modelling. Sleep was markedly disrupted, with obstructive sleep apnea common and analysable sleep data available for six participants. Non-rapid eye movement sleep peaked at approximately 4 AM Amyloid-β42 rose in the evening, plateaued during peak non-rapid eye movement sleep and increased sharply after 8 AM Hypocretin and lactate were positively correlated and each preceded and correlated with amyloid-β42 surges. Melatonin peaked near 6 AM and was associated with non-rapid eye movement sleep. Intracranial pressure displayed a strong circadian rhythm, peaking during non-rapid eye movement sleep, whereas hypocretin and amyloid-β42 exhibited only modest rhythmicity. These findings demonstrate that overnight ventricular cerebrospinal fluid sampling is feasible in adults with hydrocephalus. Preliminary evidence suggests that processes linked to wakefulness, rather than sleep or intrinsic circadian timing, may be the primary drivers of overnight amyloid-β42 variation. Hypocretin pathways may represent potential therapeutic targets in Alzheimer's disease, but conclusions are limited by abnormal sleep architecture and underlying neurological disease. Validation in larger and more representative populations is warranted."
41604552,Multi-View Biomedical Foundation Models for Molecule-Target and Property Prediction.,"Molecular foundation models hold promise to provide accurate predictions for a large and diverse set of downstream tasks in bio-medical research. Quality molecular representations are key and foundation model development has typically focused on a single representation or molecular view, which may have strengths or weaknesses on a given task. We develop Multi-view Molecular Embedding with Late Fusion (MMELON), an approach that integrates pre-trained graph, image and text foundation models and may be readily extended to additional views and models. The multi-view model performs robustly and is validated on over 120 tasks, including molecular solubility, ADME properties, and activity against G Protein-Coupled receptors (GPCRs). The GPCR model array is leveraged to perform a virtual screen in search of ligands binding to Alzheimer's disease related GPCRs. We identify a number of such targets and employ the multi-view model to select strong binders from a compound screen. Predictions are validated through structure-based modeling and identification of key binding motifs."
41596653,"Design, Synthesis, and Biological Evaluation of Novel Acetylcholinesterase and β-Secretase 1 Inhibitors.","A series of novel granatane-triazole hybrid molecules was designed, synthesized, and evaluated as dual acetylcholinesterase (AChE) and β-secretase 1 (BACE1) inhibitors. The compounds were obtained through a convergent synthetic route involving azide formation, triazole construction via dipolar cycloaddition, and final coupling with a granatane scaffold to give a pseudopelletierine (3-granatanone) analogue. In vitro assays demonstrated that all target compounds inhibited both AChE and BACE1. Molecular docking and molecular dynamics simulations revealed stable interactions with key catalytic residues, suggesting distinct binding modes compared to reference ligands. QSAR-based pharmacokinetic predictions indicated favorable blood-brain barrier permeability and compliance with key drug-likeness filters. These findings identify granatane-triazole hybrids as promising multi-target directed ligand (MTDL) candidates with potential for further optimization in the search for new anti-Alzheimer therapeutics."
41599761,Aptamer-Based Delivery of Genes and Drugs Across the Blood-Brain Barrier.,"The blood-brain barrier (BBB) restricts therapeutic delivery to the central nervous system (CNS), hindering the treatment of neurological disorders, such as Alzheimer's disease, Parkinson's disease, brain cancers, and stroke. Aptamers, short single-stranded DNA or RNA oligonucleotides that can fold into unique 3D shapes and bind to specific target molecules, offer high affinity and specificity, low immunogenicity, and promising BBB penetration via receptor-mediated transcytosis targeting receptors such as the transferrin receptor (TfR) and low-density lipoprotein receptor-related protein 1 (LRP1). This review examines aptamer design through the Systematic Evolution of Ligands by Exponential Enrichment (SELEX) and its variants, mechanisms of BBB crossing, and applications in CNS disorders. Recent advances, including in silico optimization, in vivo SELEX, BBB chip-based MPS-SELEX, and nanoparticle-aptamer hybrids, have identified brain-penetrating aptamers and enhanced the brain delivery efficiency. This review highlights the potential of aptamers to transform CNS-targeted therapies."
41590318,Smart Biosensing Nanomaterials for Alzheimer's Disease: Advances in Design and Drug Delivery Strategies to Overcome the Blood-Brain Barrier.,"Alzheimer's disease (AD) is a progressive neurodegenerative disorder marked by persistent memory impairment and complex molecular and cellular pathological changes in the brain. Current treatments, including acetylcholinesterase inhibitors and memantine, only help with symptoms for a short time and do not stop the disease from getting worse. This is mainly because these drugs do not reach the brain well and are quickly removed from the body. The blood-brain barrier (BBB) restricts the entry of most drugs into the central nervous system; therefore, new methods of drug delivery are needed. Nanotechnology-based drug delivery systems (NTDDS) are widely studied as a potential approach to address existing therapeutic limitations. Smart biosensing nanoparticles composed of polymers, lipids, and metals can be engineered to enhance drug stability, improve drug availability, and target specific brain regions. These smart nanoparticles can cross the BBB via receptor-mediated transcytosis and other transport routes, making them a promising option for treating AD. Additionally, multifunctional nanocarriers enable controlled drug release and offer theranostic capabilities, supporting real-time tracking of AD treatment responses to facilitate more precise and personalized interventions. Despite these advantages, challenges related to long-term safety, manufacturing scalability, and regulatory approval remain. This review discusses current AD therapies, drug-delivery strategies, recent advances in nanoparticle platforms, and prospects for translating nanomedicine into effective, disease-modifying treatments for AD."
41599368,Experimental Models and Translational Strategies in Neuroprotective Drug Development with Emphasis on Alzheimer's Disease.,"Neurodegenerative diseases (NDDs), including Alzheimer's disease (AD), Parkinson's disease (PD), amyotrophic lateral sclerosis (ALS) and frontotemporal dementia (FTD), are becoming more prevalent and still lack effective disease-modifying therapies (DMTs). However, translational efficiency remains critically low. For example, a ClinicalTrials.gov analysis of AD programs (2002-2012) estimated ~99.6% attrition, while PD programs (1999-2019) achieved an overall success rate of ~14.9%. In vitro platforms are assessed, ranging from immortalized neuronal lines and primary cultures to human-induced pluripotent stem cell (iPSC)-derived neurons/glia, neuron-glia co-cultures (including neuroinflammation paradigms), 3D spheroids, organoids, and blood-brain barrier (BBB)-on-chip systems. Complementary in vivo toxin, pharmacological, and genetic models are discussed for systems-level validation and central nervous system (CNS) exposure realism. The therapeutic synthesis focuses on AD, covering symptomatic drugs, anti-amyloid immunotherapies, tau-directed approaches, and repurposed drug classes that target metabolism, neuroinflammation, and network dysfunction. This review links experimental models to translational decision-making, focusing primarily on AD and providing a brief comparative context from other NDDs. It also covers emerging targeted protein degradation (PROTACs). Key priorities include neuroimmune/neurovascular human models, biomarker-anchored adaptive trials, mechanism-guided combination DMTs, and CNS PK/PD-driven development for brain-directed degraders."
41547241,Targeting neuroinflammation by activation of the sigma-1 receptor (S1R) and inhibition of butyrylcholinesterase (hBChE) leads to highly potent anti-amnesic compounds in an Alzheimer's disease mouse model.,"Alzheimer's disease (AD) is a neurodegenerative disorder for which no effective preventative or curative treatment has yet been identified. Due to the multifactorial nature and complex pathophysiology of the disease, we developed a multi-target ligand that both inhibits human butyrylcholinesterase (hBChE), a key enzyme linked to β-amyloid plaque formation, and activates the sigma-1 receptor (S1R), which modulates neuroinflammatory and protective pathways. To this end, a series of isoindolines were designed and synthesized, and their biological activities were evaluated. The most promising compound, 7c, exhibited significant dual activity, achieving nanomolar IC<sub>50</sub> values against hBChE and potent S1R activation. Subsequent in vivo studies in an Aβ<sub>25-35</sub> mouse model revealed a remarkable improvement in cognitive deficits in both short- and long-term memory at an effective dose of 0.01 mg/kg in WT Swiss-OF1 mice. This dose is 10-fold lower compared to single-target compounds 7a and 7b of this isoindoline series. The lack of neuroprotective effects in BChE knock-out (KO) mice confirmed the involvement of BChE inhibition in the pharmacological effects of compound 7c in WT mice. Further combinatorial studies employing a two-drug combination demonstrated synergy in the neuroprotective effect of addressing the two targets."
41553588,"Metallothioneins in Neurodegenerative Diseases: Metal Homeostasis, Autoimmunity, and Therapeutic Potential.","Neurodegenerative diseases, including multiple sclerosis, Parkinson's disease, Alzheimer's disease, and amyotrophic lateral sclerosis, are characterized by progressive neuronal loss and are frequently linked to metal dysregulation, oxidative stress, and immune dysfunction. Metallothioneins (MTs), a family of cysteine-rich, metal-binding proteins, are critical in maintaining metal homeostasis, mitigating oxidative damage, and modulating immune responses, functions highly relevant in these pathologies. MTs regulate essential metals like copper and iron by preventing their participation in harmful redox reactions and control zinc availability for enzymatic and signaling processes. They also detoxify neurotoxic metal(oid)s such as cadmium, mercury, lead, and arsenic, thereby reducing their adverse neurological and immunological effects. In autoimmune neurodegeneration, MTs modulate pro- and anti-inflammatory cytokines (e.g., IL-6, TNF-α, IL-10) and influence immune cell activity, particularly microglia and T cells, which are central to neuroinflammation and autoimmunity. Through these mechanisms, MTs play a dual role in sustaining immune homeostasis and counteracting oxidative stress. Their capacity to integrate metal regulation with immune modulation positions them as promising therapeutic targets, with preclinical and some clinical evidence supporting strategies to enhance MT expression or develop MT-mimetic agents to address both metal dysregulation and immune imbalance. Additionally, MTs show emerging utility as biomarkers, as alterations in MT isoform expression and metal-bound complexes in biofluids have been associated with disease onset, progression, and therapeutic response in specific neurodegenerative conditions. This article reviews the multifaceted roles of MTs in neurodegenerative diseases, emphasizing their function in metal and immune regulation and their emerging potential as therapeutic targets and clinical biomarkers."
41599691,The Expanding Role of Non-Coding RNAs in Neurodegenerative Diseases: From Biomarkers to Therapeutic Targets.,"Non-coding RNAs have emerged as central regulators of gene expression in neurodegenerative diseases, offering new opportunities for diagnosis and therapy. This review synthesizes current knowledge on microRNAs, long non-coding RNAs, and circular RNAs in Alzheimer's disease, Parkinson's disease, and amyotrophic lateral sclerosis, emphasizing their roles in synaptic function, proteostasis, mitochondrial biology, and neuroinflammation. We evaluate evidence supporting non-coding RNAs as circulating and tissue-based biomarkers for early detection, disease monitoring, and patient stratification, and we compare analytical platforms and biofluid sources. Mechanistic insights reveal how non-coding RNAs modulate pathogenic protein aggregation, neuronal excitability, immune cell crosstalk, and blood-brain barrier integrity. Translational efforts toward RNA-targeted interventions are reviewed, including antisense oligonucleotides, small interfering RNAs, miRNA mimics and inhibitors, circular RNA decoys, and extracellular vesicle-mediated delivery systems. We discuss pharmacological modulation, delivery challenges, safety concerns, and strategies to enhance specificity and CNS penetration. Finally, we outline emerging computational and multi-omics approaches to prioritize therapeutic targets and propose a roadmap for advancing non-coding RNA research from preclinical models to clinical trials. Addressing biological heterogeneity and delivery barriers will be pivotal to realizing the diagnostic and therapeutic promise of the non-coding transcriptome in neurodegenerative disease. Collaboration across disciplines and rigorous clinical validation are urgently needed."
41588609,From gut to brain: formulation and transporter-guided approaches to maximise rutin central nervous system delivery.,"Neurological disorders, including Alzheimer's and Parkinson's disease, are characterised by high morbidity and disability, representing a major global health challenge. A central obstacle in their treatment is the <i>blood-brain barrier</i>, a highly selective interface that limits drug delivery to the central nervous system. Rutin, a naturally occurring flavonoid, exhibits potent antioxidant, anti-inflammatory, and neuroprotective activities, yet its clinical utility remains constrained by poor solubility, low oral bioavailability, and restricted <i>blood-brain barrier</i> permeability. Recent advances in drug delivery and formulation science offer promising solutions. Nanoparticle encapsulation, peptide conjugation, intranasal delivery, and co-administration with absorption enhancers have been shown to improve rutin's solubility, metabolic stability, and central nervous system penetration in preclinical models. Mechanistic studies further reveal that rutin can modulate efflux transporters, regulate tight-junction proteins, and influence microglial activity and cellular metabolism, collectively contributing to enhanced neuroprotection. Experimental evidence highlights its potential to mitigate key neurodegenerative processes, particularly in Alzheimer's disease. This review synthesises current knowledge on rutin's pharmacological effects, limitations in bioavailability, and innovative strategies to improve <i>blood-brain barrier</i> penetration. By integrating mechanistic insights with advances in delivery technologies, this review underscores rutin's translational potential. Priority next steps include optimising delivery systems, establishing long-term safety, and conducting well-designed clinical trials to define efficacy and dosing."
41597249,Olfactory Dysfunction and Cognitive Deterioration in Long COVID: Pathomechanisms and Clinical Implications in Development of Alzheimer's Disease.,"Complete or partial loss of smell (anosmia), sometimes in association with distorted olfactory perceptions (parosmia), is a common neurological symptom affecting nearly 60% of patients suffering from post-acute neurological sequelae of COronaVIrus Disease of 2019 (COVID-19) syndrome, called long COVID. Severe Acute Respiratory Syndrome CoronaVirus 2 (SARS-CoV-2) may gain access from the nasal cavity to the brain (neurotropism), and the olfactory route has been proposed as a peripheral site of virus entry. COVID-19 is a risk factor for developing Alzheimer's Disease (AD), an age-dependent and progressive neurodegenerative disorder characterized in affected patients by early olfaction dysfunction that precedes signs of cognitive decline associated with neurodegeneration in vulnerable brain regions of their limbic system. Here, we summarize the recent literature data supporting the causal correlation between the persistent olfactory deterioration following SARS-CoV-2 infection and the long-delayed manifestation of AD-like memory impairment. SARS-CoV-2 infection of the olfactory neuroepithelium is likely to trigger a pattern of detrimental events that, directly and/or indirectly, affect the anatomically interconnected hippocampal and cortical areas, thus resulting in tardive clinical dementia. We also delineate future advancement on pharmacological and rehabilitative treatments to improve the olfactory dysfunction in patients recovering even from the acute/mild phase of COVID-19. Collectively, the present review aims at highlighting the physiopathological nexus between COVID-19 anosmia and post-pandemic mental health to favor the development of best-targeted and more effective therapeutic strategies in the fight against the long-term neurological complications associated with SARS-CoV-2 infection."
41547891,Intranasal blood-brain barrier bypass enables sequential mitochondria-targeted bioengineered nanolamellar system for ischemic stroke therapy.,"Mitochondrial damage constitutes the central pathological mechanism of cerebral ischemia-reperfusion (I/R) injury. Targeted delivery of antioxidants to mitochondria and the phenotype polarization of glial cells holds great promise for effective treatment. However, the blood-brain barrier (BBB) remains a major obstacle, causing insufficient drug accumulation in neuronal mitochondria. Here, we develop a bioengineered nanolamellar system (MM@BPPF) by coating microglia-mitochondria hybrid biomembrane onto black phosphorus nanosheets (BP NSs) loaded with polymetformin (PolyMet) and fingolimod hydrochloride (FTY720). Microglia membrane facilitates inflammation-directed targeting to the injured brain regions, while mitochondria membrane confers homotypic targeting to mitochondria. Meanwhile, BP NSs, PolyMet, and FTY720 act sequentially to restore mitochondrial function of neuronal cells and modulate microglial polarization. Intranasal administration enables MM@BPPF to bypass the BBB, substantially improving brain-targeting efficiency. This work not only offers an innovative sequential targeting strategy for mitigating I/R injury but also presents a potential paradigm for treating other central nervous system disorders."
41564643,Development and quality control studies of radiolabelled nanostructured lipid formulations with Ga-68.,"This study aims to radiolabel a nanoparticle formulation containing donepezil with Ga-68 radionuclide with high efficiency for diagnosing Alzheimer's disease. In order to develop lipid carrier systems with biocompatible contents in nanoparticle structures, extensive formulation studies were conducted. These systems were subsequently radiolabeled with Ga-68 radionuclide to evaluate their radiolabeling efficiencies. The results are highly encouraging, suggesting that effective radiolabeling is indeed possible. These findings are particularly significant as they open up a range of applications for targeted drug delivery, medical imaging, and diagnostics. Overall, this study represents a valuable contribution to the expanding body of knowledge on lipid carrier systems in healthcare. Nanocarrier formulations were prepared. The radiolabeling parameters of the prepared formulations were studied comparatively. A Ga-68 radionuclide with a half-life of 68 min was used for this. Incubation time, amount of radioactivity, and pH parameters were studied. The radiolabeling incubation time, pH of the experimental medium, and amount of radioactivity were tested, and the optimal parameters were identified. According to the results of the radiolabeling studies, optimal radiolabeling with Ga-68 radionuclide was obtained in an acid medium (pH: 5), with a 60 min incubation time, and using 5 mCi of activity in the DOTA-functionalized nanolipid formulations, achieving 89.17 % efficiency. Furthermore, quantitative in vivo PET/CT imaging in nude mice (n = 3/group) demonstrated that the optimized Ga-68-DNP-NLC formulation achieved statistically significant and higher brain uptake compared to the free Ga-68 control, confirming its ability to cross the blood-brain barrier."
41548855,Metal-directed nanomedicines for imaging-guided disease treatment.,"Metal-directed self-assembly, driven by metal-ligand coordination, represents a highly versatile and efficient strategy for constructing drug delivery systems with precisely tunable properties, inherent imaging capabilities, and broad biomedical applications. Stimuli-responsive metal-directed drug delivery systems (MDDSs), guided by advanced imaging techniques, enable precise control over their size and spatial architecture while facilitating site-specific drug release. Moreover, certain metal ions play a dual role, not only orchestrating the self-assembly process but also serving as therapeutic agents and regulatory components for the treatment of various diseases, including cancer, microbial infections, and Alzheimer's disease. This review provides a comprehensive overview of the self-assembly mechanisms underlying diverse MDDSs and their applications in image-guided therapy. Furthermore, we critically examine existing challenges in the field and propose strategic directions to propel the advancement of metal-directed self-assembly in drug delivery. Given the profound implications of this research, further exploration of the critical roles of metal coordination in self-assembly is imperative for the development of next-generation drug delivery platforms. STATEMENT OF SIGNIFICANCE: This review systematically summarize the self-assembly mechanisms of metal-directed drug delivery systems, outlines their applications in image-guided therapy and discusses the current challenges that remain. Furthermore, it elucidates the unique regulatory roles of metal ions in precise drug release and multimodal therapy, providing valuable insights and broad appeal for the development and clinical translation of next-generation smart nanomedicine platforms."
41579998,Carboxymethyl chitosan for neurological drug delivery: Current trends and future prospects.,"The complexity of drug delivery across the blood-brain barrier (BBB) makes disorders of the central nervous system (CNS), such as Alzheimer's disease, Parkinson's disease(PD), brain tumors, and other neurodegenerative conditions, a growing global health burden. Poor brain bioavailability and systemic side effects are common problems with traditional therapies. Delivery systems based on nanotechnology have shown promise as solutions to these problems. These include carboxymethyl chitosan (CMC), a water-soluble, biocompatible, and biodegradable chitosan derivative that has drawn a lot of interest because of its increased stability, mucoadhesiveness, improved solubility at physiological pH, and ability to encapsulate and release targeted drugs. CMC-based nanocarriers are perfect for treating a variety of conditions because they have shown promise in increasing therapeutic efficacy while reducing toxicity. Recently developed CMC-based drug delivery systems for CNS disorders are examined critically in this review, with an emphasis on their design, biological performance, targeting techniques, and potential for clinical translation in the future. Their multifunctional qualities, in vitro and in vivo evidence, and their function in regulating neuroinflammation, oxidative stress, and neuronal regeneration are given particular attention."
