pmid,title,abstract
41603986,Computational prioritization of multi-target inhibitors: explainable QSAR and docking-based discovery of dual AChE/BACE1 chemotypes.,"The discovery of dual acetylcholinesterase (AChE) and β-secretase (BACE1) inhibitors remains a promising strategy against multifactorial Alzheimer's disease. Here, rigorously curated ChEMBL-derived data were used to develop explainable QSAR (Quantitative structure-activity relationship) models for dual-inhibition prioritization. Molecules were standardized, near-duplicates were removed using a Tanimoto similarity threshold (≥ 0.80), and physicochemical outliers were filtered prior to modeling. Multiple classifiers (including Light Gradient-Boosting Machine, eXtreme Gradient Boosting, Random Forest, Support Vector Machine, k-Nearest Neighbors and Gradient Boosting Decision Trees) and fingerprints (e.g., RDKit fingerprints, Extended Connectivity Fingerprint) were benchmarked under scaffold-based nested cross-validation to prevent data leakage. Class imbalance was handled with SMOTETomek applied strictly within training folds. Model selection relied on F-Score, Area Under the Precision-Recall Curve, Matthews Correlation Coefficient (MCC), and Recall, and performance was accompanied by bootstrap confidence intervals, calibration curves, and Y-randomization controls. In classification, the top model (GBDT + ECFP6) achieved strong generalization (Recall ≈ 1.00, PR-AUC ≈ 0.84, MCC ≈ 0.81, F1 Score ≈ 0.84). Shapley Additive Explanations (SHAP) analysis highlighted aromatic and hydrogen-bonding substructures as key positive contributors. Prospective candidates (e.g., CHEMBL5082250, CHEMBL1651126, CHEMBL1651127) were evaluated by active-site-focused docking against AChE (PDB: 4EY7) and BACE1 (PDB: 2G94) with essential waters retained; docking scores (ΔG, kcal·mol⁻<sup>1</sup>) were used for relative ranking of the ligands. SwissADME/pkCSM profiling suggested CNS-relevant properties (e.g., MPO, logBB, P-gp liability) and acceptable oral drug-likeness. Collectively, the workflow provides a reproducible and transparent pipeline for prioritizing dual AChE/BACE1 chemotypes and nominates testable scaffolds for experimental validation."
41575328,Targeted Delivery of Quercetin to the Brain via a Modified Polymeric Nanocarrier.,"Quercetin (Qt) exhibits significant neuroprotective potential in Alzheimer's disease; however, its clinical translation is limited by poor solubility, low permeability, and inadequate brain bioavailability. In this study, a modified polymeric nanocarrier was developed to enhance Qt delivery to the brain. Polyethyleneimine (PEI) was conjugated with polyethylene glycol (PEG) and further functionalized with phenylalanine to reduce PEI-associated toxicity and improve brain-targeting efficiency. Successful polymer synthesis was confirmed by FT-IR spectroscopy, showing characteristic S─S bond formation at 790 cm<sup>-</sup> <sup>1</sup>, mass spectrometry (m/z 1087.3), and differential scanning calorimetry. Nanoparticles were optimized using a Quality by Design approach, yielding an experimental particle size of 161.4 ± 1.10 nm, zeta potential of 15.9 ± 2.5 mV, and high entrapment efficiencies of 84.21 % and 86.74 % for Qt-PEI-Np and Qt-PEI-PEG-S-S-AA-Np, respectively. SEM analysis revealed spherical nanoparticles with nanoscale surface roughness and good stability. In vitro release studies demonstrated sustained Qt release (98 % over 48 h). MTT assays and cytokine analysis (TNF-α, IL-1β, IL-6) confirmed biocompatibility. Enhanced intestinal permeability, absence of hippocampal toxicity, and effective BBB transport further support the potential of this nanocarrier for targeted neurotherapeutic delivery."
41604360,"A Global, Regional, and National Survey on Burden and Quality of Care Index of Alzheimer's Disease and Other Dementias in Adults Aged 55 and Above: The Global Burden of Disease Study 1990-2021.","Alzheimer's disease and other dementias (ADOD) represent a growing global health challenge. This study aims to propose a comprehensive measure called the quality of care index (QCI) to assess disparities in quality of care (QC) for ADOD patients across global, regional, and national levels. We also evaluate temporal trends in QCI and explore associations with socioeconomic development, gender, and age. Individuals aged 55 years and older with ADOD were included in this longitudinal study using data from the global burden of disease (GBD) database spanning 1990-2021. The QCI score was calculated using four indicators. Principal component analysis was employed to compute the QCI. The QCI was rescaled to a single index ranging from 0 to 100, where higher scores indicate better QC. The global QCI increased from 32.9 in 1990 to 50.2 in 2021, with a greater increase among females (68.8%) than males (52.4%). Significant gains were observed in regions with middle and high-middle sociodemographic index), while slight declines occurred in high- and low-middle SDI regions, and slow progress was seen in low SDI regions. The gender gap in QCI narrowed, with females outperforming males in low SDI regions. QCI scores showed a marked increase with age, reflecting lower QC access in younger age groups and a sharp rise in older age groups. Substantial disparities in QCI exist globally and regionally across age cohorts and between men and women. Policymakers should prioritize targeted interventions to address these gaps, improve access to high-quality care, and alleviate the global burden of ADOD."
41570392,"Clinical, imaging and blood biomarker outcomes in a Phase 3 clinical trial of tau aggregation inhibitor hydromethylthionine mesylate in mild cognitive impairment and mild to moderate dementia due to Alzheimer's disease.","Hydromethylthionine mesylate (HMTM) targets tau pathology and has tau-independent symptomatic activity. To evaluate the safety and efficacy of HMTM in participants with mild cognitive impairment (MCI) and mild to moderate dementia due to Alzheimer's disease (AD). 82 centres in Canada, European Union, United Kingdom and United States of America. A total of 598 amyloid β-PET positive participants were included; 44% (263) met clinical criteria for MCI due to Alzheimer's disease and 56% (335) were diagnosed with mild to moderate dementia due to AD. HMTM 16 mg/day and 8 mg/day were compared with methylthioninium chloride (MTC) 4 mg twice weekly, intended as an inactive urinary colourant to preserve blinding with respect to possible urinary discolouration caused by HMTM. HMTM and MTC were compared on cognitive and functional endpoints for the first 52 weeks followed by all receiving HMTM 16 mg/day to 104 weeks in a modified delayed-start trial design. Biomarker outcomes included change in plasma levels of neurofilament light chain (NfL), pTau217 and MRI measures of grey matter atrophy. It was not possible to demonstrate significant differences on the co-primary clinical endpoints (ADAS-cog<sub>11</sub> and ADCS-ADL<sub>23</sub>) at 52 weeks due to symptomatic activity in the control arm. In participants with MCI, statistically significant differences in cognitive decline (ADAS-cog<sub>13</sub>) emerged at 78 weeks (p = 0·0291) and 104 weeks (p = 0·0308) between early- and delayed-start HMTM 16 mg/day in analyses specified prior to the 24-month database lock. Statistically significant cognitive improvement over baseline score was sustained for 78 weeks in the early start MCI group, with no significant cognitive or functional decline to 104 weeks. There was a significant reduction in progression of neurodegeneration measured by NfL change (p = 0·0291) at 52 weeks in the whole population, consistent with significant reductions in progression of grey matter atrophy at 52 and 104 weeks, and a reduction in progression of tau pathology (pTau217, p = 0·0165) in MCI. Headache (1·5%) and diarrhoea (1·2%) were the most frequent adverse effects. Although HMTM 16 mg/day arrested progression of neurodegeneration and reduced grey matter atrophy at 52 weeks, symptomatic activity in the control arm precluded separation of treatment arms at 52 weeks on primary clinical endpoints. In participants with MCI, significant clinical separation was seen only at 78 and 104 weeks. This effect has been confirmed in a further study. HMTM was well tolerated and has the potential to offer an accessible oral treatment option with a benign safety profile which could be delivered with minimal patient/physician burden."
41601548,Ferroptosis in Alzheimer's disease: molecular mechanisms and advances in therapeutic strategies.,"Alzheimer's disease (AD) is a progressive neurodegenerative disorder characterized primarily by the continuous decline of cognitive functions. Its pathogenesis involves complex, multidimensional interactions among various molecular pathways. In recent years, ferroptosis, a regulated form of iron-dependent cell death, has emerged as a crucial contributor to AD progression. Ferroptosis is defined by the accumulation of lipid peroxides and inactivation of glutathione peroxidase 4 (GPX4), and is typically initiated in the context of disrupted iron homeostasis, aberrant lipid metabolism, and mitochondrial dysfunction in the brain. This review comprehensively delineates the molecular mechanisms underlying dysregulated iron metabolism in AD and proposes an integrative ""iron-lipid-energy-inflammation"" axis as a pathological framework. Particular attention is given to the GPX4 signaling pathway as a central hub linking lipid peroxidation, mitochondrial damage, and immune responses. Moreover, ferroptosis can propagate through intercellular mechanisms involving the release of damage-associated molecular patterns (DAMPs), dysregulation of immune checkpoints, and exosome-mediated signaling, collectively driving microglial activation, T-cell infiltration, and blood-brain barrier disruption, culminating in systemic immune imbalance. We further evaluate multiple therapeutic strategies targeting ferroptosis, including iron chelators, antioxidants, GPX4 activators, and lipoxygenase inhibitors. Based on emerging evidence, we propose a precision medicine approach that incorporates ferroptosis subtyping, multi-omics analysis, and targeted delivery systems. Ferroptosis represents a promising frontier for early diagnosis and intervention in AD, potentially enabling the development of causality-oriented, mechanism-based therapies."
41596255,Targeting the Gut Microbiota: Mechanistic Investigation of Polyphenol Modulation of the Gut-Brain Axis in Alzheimer's Disease.,"Alzheimer's disease (AD) represents an increasingly severe global health challenge. Recently, the role of the gut-brain axis in AD pathogenesis has garnered significant attention. Dysbiosis of the gut microbiota can exacerbate core pathologies such as neuroinflammation, amyloid beta (Aβ) deposition, and tau hyperphosphorylation through neural, endocrine, and immune pathways. Polyphenolic compounds have emerged as a focal point in neuroprotective research owing to their pronounced anti-inflammatory and antioxidant properties. Notably, polyphenols exert effects not only by directly influencing the central nervous system (CNS) but also through indirectly modulating the composition and function of the gut microbiota, thereby impacting bidirectional gut-brain communication. This dual mechanism offers a potential avenue for their application in the prevention and treatment of AD. This review aims to compile recent research on the relationship between polyphenols and the gut microbiota. We assessed the literature from PubMed, Google Scholar, and Web of Science databases, published from the establishment of the database to 24 November 2025. The keywords used include ""Polyphenols"", ""Gut-brain axis"", ""Gut microbiota"", ""Alzheimer's disease"", ""Epigallocatechin gallate"", ""Quercetin"", ""Curcumin"", ""Ferulic acid"", ""Resveratrol"", ""Anthocyanin"", ""Myricetin"", ""Chlorogenic acid"", etc. This review discusses the various mechanisms by which polyphenols influence AD through modulating the gut microbiota. Polyphenols and gut microbiota exhibit critical bidirectional interactions. On one hand, the bioavailability and activity of polyphenols are highly dependent on metabolic conversion by gut microbiota. On the other hand, polyphenols selectively promote the proliferation of beneficial bacteria such as bifidobacteria and lactobacilli like prebiotics, while inhibiting the growth of pathogenic bacteria. This reshapes the intestinal microecology, enhances barrier function, and regulates beneficial metabolites. Utilizing a nanotechnology-based drug delivery system, the pharmacokinetic stability and brain targeting efficacy of polyphenols can be significantly enhanced, providing innovative opportunities for the targeted prevention and management of AD."
41604898,Sinomenine inhibits oxidative stress to attenuate Alzheimer's disease pathology via α7 nicotinic acetylcholine receptor.,"The pathological mechanism of Alzheimer's disease (AD) is complex. The binding of Aβ to α7 nicotinic acetylcholine receptor (α7nAChR) contributes to neuronal damage. Sinomenine (SIN) is an alkaloid extracted from the traditional Chinese medicine Qingfengteng (Sinomenium acutum). The anti-inflammatory, antioxidant, and immunomodulatory effects of SIN were confirmed to be closely associated with the α7nAChR. This study aimed to investigate whether α7nAChR serves as a pharmacological target of SIN against AD, and to evaluate the neuroprotective effects of SIN both in vivo and in vitro, focusing on the α7nAChR/Nrf2/Keap1 signaling pathway. In this study, the effects of SIN in both APP/PS1 transgenic mice and SH-SY5Y cells subjected to Aβ1-42-induced injury were assessed. The selective antagonist α-bungarotoxin ‌(α-BTX), the agonist nicotine (Nic) of α7nAChR, and α7nAChR siRNA were employed. The cognitive function, Aβ deposition, synaptic plasticity markers, the tau protein phosphorylation, mitochondrial membrane potential, oxidative stress and the α7nAChR/Nrf2/Keap1 signaling pathway were analyzed in vivo and/or in vitro. SIN significantly enhanced learning and memory abilities in APP/PS1 mice, reduced Aβ plaque deposition and synaptic dysfunction, and inhibited hyperphosphorylation of tau protein and oxidative stress in the brain. In Aβ1-42-induced neuronal injury model, SIN alleviated apoptosis, increased BDNF and ACh levels, inhibited mitochondrial damage, stabilized calcium homeostasis, and suppressed oxidative stress. Meanwhile, SIN disrupted Nrf2-Keap1 binding to promote the Nrf2/HO-1 signaling pathway. Nevertheless, SIN effects above were inhibited by α-BTX. The knockdown of α7nAChR in vitro significantly promoted Nrf2/HO-1 pathway and BDNF expression. SIN exerts neuroprotective effect in APP/PS1 transgenic mice and Aβ1-42-induced neuronal injury by inhibiting oxidative stress via α7nAChR/Nrf2/Keap1 pathway. This study provides evidence for α7nAChR as a new target and the clinical application potential of SIN in AD treatment."
41595681,Network Analysis to Identify MicroRNAs Involved in Alzheimer's Disease and to Improve Drug Prioritization.,"<b>Background</b>: Advances in the understanding of molecular mechanisms of human diseases, along with the generation of large amounts of molecular datasets, have highlighted the variability between patients and the need to tailor therapies to individual characteristics. In particular, RNA-based therapies hold strong promise for new drug development, as they can be easily designed to target specific molecules. Gene and protein functions, however, operate within a highly interconnected network, and inhibiting a single function or repressing a single gene may lead to unexpected secondary effects. In this study, we focused on genes associated with Alzheimer's disease, a progressive neurodegenerative disorder characterized by complex pathological processes leading to cognitive decline and dementia. Its hallmark features include the accumulation of extracellular amyloid-β plaques and intracellular neurofibrillary tangles composed of hyperphosphorylated tau. <b>Methods</b>: We built a protein interaction network subgraph seeded on five Alzheimer's-associated genes, including tau and amyloid-β precursor, and integrated it with microRNAs in order to select regulated nodes, study the effects of their depletion on signaling pathways, and prioritize targets for microRNA-based therapeutic approaches. <b>Results</b>: We identified nine protein nodes as potential candidates (Pik3R1, Bace1, Traf6, Gsk3b, Akt1, Cdk2, Adam10, Mapk3 and Apoe) and performed in silico node depletion to simulate the effects of microRNA regulation. <b>Conclusions</b>: Despite intrinsic limitations of the approach, such as the incompleteness of the available information or possible false associations, the present work shows clear potential for drug design and target prioritization and underscores the need for reliable and comprehensive maps of interactions and pathways."
41577863,Exploring Green-Synthesized Silver Nanoparticles in Neurodegeneration: a Systematic Review of Cholinesterase Enzyme Interactions.,"Neurodegenerative disorders, particularly Alzheimer's disease (AD), Parkinson's disease (PD), and Huntington's disease (HD), represent a significant and growing global health concern in recent decades due to their complex pathology and lack of curative treatments. The fundamental cause of the evolution of these disorders is the dysfunction of cholinergic neurotransmission; those are mostly regulated by cholinesterase enzymes such as acetylcholinesterase (AChE) and butyrylcholinesterase (BChE). Conventional synthetic cholinesterase inhibitors like donepezil, rivastigmine, and galantamine are proposed for symptomatic relief but are often associated with adverse effects, limited bioavailability, and decreased long-term efficacy. Here, green-synthesized silver nanoparticles (AgNPs), which are derived from plant extracts and other biological systems, give an extraordinary alternative. These nanoparticles offer a biocompatible, eco-friendly, and cost-effective alternative to conventional synthetic methods. Greener AgNPs inhibit them by binding to the enzymes AChE and BChE and prevents them from breaking down neurotransmitters ACh and BCh. As a result, the count of neurotransmitters remains high in the synapse and can provide an effective synaptic transmission. Green-synthesized AgNPs can provide targeted drug delivery, enhance solubility, enhance bioavailability, improve absorption, and also be able to overcome the blood-brain barrier (BBB); all these characteristics give better therapeutic action than all conventional methods. This study evaluates the efficacy of green-synthesized silver nanoparticles in combination with several medicinal plants for treating neurodegenerative diseases, encouraging further research to upgrade these formulations for improved patient outcomes and increased clinical applicability."
41605956,SMILES-based QSAR analysis of carbamate derivatives targeting butyrylcholinesterase.,"Butyrylcholinesterase (BuChE) is a key enzyme implicated in the pathogenesis of Alzheimer's disease (AD), and its inhibition represents a promising therapeutic strategy for disease management. Among various inhibitor classes, carbamate derivatives have attracted significant attention due to their pseudo-irreversible inhibition mechanism and favorable pharmacological profiles, making them valuable scaffolds in anti-Alzheimer drug discovery. In this study, a dataset of 205 carbamate derivatives was carefully compiled from reliable peer-reviewed literature, and QSAR modeling was performed for the first time on this dataset. Quantitative structure-activity relationship (QSAR) models were constructed to predict the BuChE inhibitory activity (pIC50) employing Monte Carlo optimization within the CORAL-2023 software framework. Hybrid optimal descriptors derived from SMILES notation and hydrogen-suppressed molecular graphs were utilized. Sixty models were developed across four random splits using four distinct target functions (TF0-TF3), among which the TF3-based models exhibited superior statistical performance (validation R<sup>2</sup> ranging from 0.80 to 0.86, Q<sup>2</sup> between 0.78 and 0.84, and RMSE values from 0.45 to 0.54). The mechanistic interpretation of the model showed that the increasing SMILES-based descriptors correspond to key pharmacophoric regions of the BuChE active site, including the PAS, acyl pocket, and catalytic triad. These correlations confirm that aromatic, hydrophobic, and branched fragments enhance inhibitory activity through π-π interactions, hydrophobic anchoring, and optimal orientation toward Ser198."
41604441,Spatial variation in socio-economic vulnerability to Influenza-like Infection for the US population.,"This study aims to quantify environmental health impacts and assess risk by understanding the disproportionate burden of infectious diseases, specifically Influenza-like Illness (ILI), across regions with varying socio-economic characteristics. We introduce a novel vulnerability-based approach to better understand the complex relationship between socio-economic factors and ILI burden. We developed a machine-learning-driven framework to assess and map state-level socio-economic vulnerability to ILI in the United States. A vulnerability index was created by integrating 39 diverse socio-economic and health indicators from the latest CENSUS. A Random Forest Regression model then weighed these indicators to quantify each state's vulnerability for the ILI values in 2022. To assess multicollinearity, Variance Inflation Factor (VIF) was calculated, and parameters were filtered to reduce the VIF. Key determinants of vulnerability include migration patterns, insurance coverage, and proportions of female and elderly populations. The resulting state-level vulnerability map reveals significant regional disparities. District of Columbia was identified as the most vulnerable state, followed by Massachusetts, Hawaii, New Mexico, and Rhode Island, all with normalized vulnerability indices exceeding 0.35. Our findings highlight significant regional variations in ILI vulnerability, emphasizing the need for targeted public health interventions tailored to state-specific socio-economic conditions. This scalable and adaptable methodology extends beyond influenza, offering a valuable approach for assessing vulnerability to a wide range of infectious diseases, strengthening epidemic preparedness and response."
41599177,"Extracellular Vesicles in Alzheimer's Disease: Dual Roles in Pathogenesis, Promising Avenues for Diagnosis and Therapy.","Alzheimer's disease (AD) is a progressive neurodegenerative disorder characterized by the accumulation of amyloid-β (Aβ) plaques, neurofibrillary tau tangles, chronic neuroinflammation, and synaptic loss, leading to cognitive decline. Extracellular vesicles (EVs)-lipid bilayer nanoparticles secreted by nearly all cell types-have emerged as critical mediators of intercellular communication, playing a complex dual role in both the pathogenesis and potential treatment of AD. This review generally delineates two opposite roles of EVs in pathogenesis and potential treatment of AD. On one hand, EVs derived from neurons, astrocytes, microglia and oligodendrocytes can propagate toxic proteins (Aβ, tau) and inflammatory signals, thereby accelerating disease progression. On the other hand, EVs-especially those from mesenchymal stem cells (MSCs)-exert neuroprotective effects by facilitating toxic protein clearance, modulating immune responses, preserving synaptic integrity, and alleviating oxidative stress. The cargo-carrying function of EVs gives them considerable diagnostic value. The associated cargos such as proteins and microRNAs (miRNAs) in the EVs may serve as minimally invasive biomarkers for early detection and monitoring of AD. Therapeutically, engineered EVs, including those incorporating CRISPR/Cas9-based genetic modification, are being developed as sophisticated delivery platforms for targeting core AD pathologies. Furthermore, this review highlights emerging technologies such as microfluidic chips and focused ultrasound (FUS), discussing their potential to enhance the translational prospects of EV-based early diagnostic and treatment for AD."
